{"bypass_actors":[],"conditions":{"exclude":[],"include":["refs/heads/master"]},"enforcement":"active","id":18806829,"name":"protect-master","repository":"PaulKov/dpone","repository_id":1255975556,"rules":[{"type":"deletion"},{"type":"non_fast_forward"},{"parameters":{"allowed_merge_methods":["merge","squash"],"dismiss_stale_reviews_on_push":true,"require_code_owner_review":false,"require_last_push_approval":false,"required_approving_review_count":0,"required_review_thread_resolution":true,"required_reviewers":[]},"type":"pull_request"},{"parameters":{"do_not_enforce_on_create":false,"required_status_checks":[{"context":"Agent PR receipt","integration_id":15368},{"context":"Analyze Python","integration_id":15368}],"strict_required_status_checks_policy":true},"type":"required_status_checks"}],"schema":"dpone.github-ruleset-projection.v1","schema_version":1,"source":"PaulKov/dpone","source_type":"Repository","target":"branch"}
